date,months_since_baseline,score,trace_name,mr_no,title,ymin,ymax
2024-07-24,1,12.666666666666666,PROMIS-10 Physical,66,PROMIS-10 Physical Health Score,16,68
2024-07-24,1,45.8,PROMIS-10 Mental,66,PROMIS-10 Mental Health Score,21,68
2024-07-24,1,15.0,ICIQ-UI SF,66,Urinary Incontinence Score (Pregnancy),0,21
2024-07-24,1,9.0,WEXNER,66,Wexner Incontinence Score (Pregnancy),0,20
2024-07-24,1,157.5,PAID,66,Problem Areas in Diabetes Score,0,100
2024-07-24,1,17.0,EPDS,66,Postnatal Depression Score (Pregnancy),0,30
